<?xml version="1.0" encoding="UTF-8"?>
<!-- edited with XMLSpy v2013 (http://www.altova.com) by  () -->
<xs:schema xmlns:xs="http://www.w3.org/2001/XMLSchema" elementFormDefault="qualified" attributeFormDefault="unqualified">
	<xs:element name="serviceConfig">
		<xs:annotation>
			<xs:documentation>Comment describing your root element</xs:documentation>
		</xs:annotation>
		<xs:complexType>
			<xs:sequence>
				<xs:element name="request">
					<xs:complexType>
						<xs:sequence>
							<xs:element name="url" type="xs:anyURI"/>
							<xs:element name="namespace" type="xs:string"/>
							<xs:element name="typename" type="xs:string"/>
							<xs:element name="filter" type="xs:string"/>
						</xs:sequence>
					</xs:complexType>
				</xs:element>
				<xs:element name="results">
					<xs:complexType>
						<xs:sequence>
							<xs:element name="locationInfo">
								<xs:complexType>
									<xs:simpleContent>
										<xs:extension base="xs:string">
											<xs:attribute name="attribute" type="xs:string"/>
										</xs:extension>
									</xs:simpleContent>
								</xs:complexType>
							</xs:element>
							<xs:element name="location">
								<xs:complexType>
									<xs:simpleContent>
										<xs:extension base="xs:string">
											<xs:attribute name="attribute" type="xs:string"/>
										</xs:extension>
									</xs:simpleContent>
								</xs:complexType>
							</xs:element>
							<xs:element name="srs">
								<xs:complexType>
									<xs:simpleContent>
										<xs:extension base="xs:string">
											<xs:attribute name="attribute" type="xs:string"/>
										</xs:extension>
									</xs:simpleContent>
								</xs:complexType>
							</xs:element>
							<xs:element name="displayInfo" maxOccurs="unbounded">
								<xs:complexType>
									<xs:simpleContent>
										<xs:extension base="xs:anyURI">
											<xs:attribute name="headChar" use="optional">
												<xs:simpleType>
													<xs:restriction base="xs:string">
														<xs:length value="1"/>
													</xs:restriction>
												</xs:simpleType>
											</xs:attribute>
											<xs:attribute name="trailChar" use="optional">
												<xs:simpleType>
													<xs:restriction base="xs:string">
														<xs:length value="1"/>
													</xs:restriction>
												</xs:simpleType>
											</xs:attribute>
											<xs:attribute name="attribute"/>
										</xs:extension>
									</xs:simpleContent>
								</xs:complexType>
							</xs:element>
						</xs:sequence>
						<xs:attribute name="separator" use="optional">
							<xs:simpleType>
								<xs:restriction base="xs:string"/>
							</xs:simpleType>
						</xs:attribute>
					</xs:complexType>
				</xs:element>
				<xs:element name="details">
					<xs:complexType>
						<xs:sequence>
							<xs:element name="detailslevel" type="detailslevel" maxOccurs="unbounded"/>
						</xs:sequence>
					</xs:complexType>
				</xs:element>
			</xs:sequence>
		</xs:complexType>
	</xs:element>
	<xs:complexType name="detailslevel">
		<xs:sequence>
			<xs:element name="label" type="xs:string"/>
			<xs:choice>
				<xs:element name="path">
					<xs:complexType>
						<xs:simpleContent>
							<xs:extension base="xs:string">
								<xs:attribute name="attribute" type="xs:string"/>
							</xs:extension>
						</xs:simpleContent>
					</xs:complexType>
				</xs:element>
				<xs:element name="detailslevel" type="detailslevel" maxOccurs="unbounded"/>
			</xs:choice>
		</xs:sequence>
	</xs:complexType>
</xs:schema>
